{
  "id":"startup-sequence",
  "concern":"What happens during system startup, in what order, and which component is active at each step?",
  "stakeholder":"software architect",
  "intent":["understand","trace","communicate"],
  "informationStructure":["sequence","process"],
  "tasks":["trace","inspect","scrub"],
  "entities":["service","message","startup-step"],
  "relationships":["invokes","precedes"],
  "scale":{"items":80,"density":"low"},
  "interaction":{"mode":"exploratory","dynamics":"animated"},
  "audience":{"expertise":"mixed","frequency":"occasional"},
  "consequence":{"risk":"medium","reversibility":"reversible"},
  "constraints":{"mobile":false,"accessibility":"baseline","realtime":false,"provenance":true,"allowAggregation":false},
  "requiredCapabilities":["provenance","temporal-order"]
}
