{
  "id": "portfolio-qualitative-analysis",
  "stakeholder": "portfolio reviewer with no prior project context",
  "scale": {
    "items": 80,
    "density": "medium"
  },
  "audience": {
    "expertise": "mixed",
    "frequency": "one-off",
    "domainFamiliarity": "novice",
    "notationFamiliarity": "novice",
    "visualizationLiteracy": "mixed"
  },
  "consequence": {
    "risk": "low",
    "reversibility": "reversible"
  },
  "constraints": {
    "mobile": false,
    "accessibility": "baseline",
    "realtime": false,
    "provenance": true,
    "allowAggregation": true
  },
  "surfaceContext": {
    "repeatedCollection": true,
    "neighboringRepresentations": "heterogeneous",
    "sharedInteractionGrammar": true,
    "medium": "portfolio"
  },
  "concern": "Show how a corpus of source documents becomes corpus-wide qualitative findings that remain inspectable back to exact source evidence.",
  "intent": [
    "understand",
    "communicate",
    "trace"
  ],
  "informationStructure": [
    "document",
    "process",
    "hierarchy"
  ],
  "tasks": [
    "trace",
    "inspect",
    "compare",
    "scrub"
  ],
  "entities": [
    "source",
    "passage",
    "code",
    "pattern",
    "finding"
  ],
  "relationships": [
    "derived-from",
    "classified-as",
    "supports"
  ],
  "interaction": {
    "mode": "exploratory",
    "dynamics": "animated"
  },
  "explanatoryFocus": [
    "transformation",
    "provenance"
  ],
  "representationRole": "explanatory",
  "abstractionLevel": "caricature",
  "concernHierarchy": {
    "primary": "Show how a corpus of source documents becomes corpus-wide qualitative findings that remain inspectable back to exact source evidence.",
    "secondary": [
      "preserve provenance and methodological rigor without making assurance mechanics the headline"
    ],
    "assuranceRole": "secondary"
  }
}
